{
  "schemaVersion": 1,
  "event_type": "system.event",
  "agent_name": "pytest",
  "git_sha": "deadbeef",
  "ts": "2026-01-08T00:00:00Z",
  "trace_id": "trace123",
  "payload": {
    "timestamp": "2026-01-08T00:00:00Z",
    "severity": "INFO",
    "service": "pytest",
    "env": "test",
    "event_type": "system.event",
    "message": "fixture"
  }
}
